SN,Quote,Author,Posted,Caption
1,The obstacle in the path becomes the *path.*,Marcus Aurelius,True,Turn trials into triumphs. ⚔️\n\nFollow for stoic strength 🔥
2,A warrior does not ask for permission to *excel.*,Unknown,False,Claim your greatness. ⚔️\n\nFollow for the grind 🔥
3,Do not explain your philosophy. *Embody* it.,Epictetus,False,Action over words. ⚔️\n\nFollow for daily discipline 🔥
4,Your mind is a weapon. Keep it *sharp.*,Unknown,False,Train the brain. ⚔️\n\nFollow for mindset power 🔥
5,"The more you sweat in peace, the less you *bleed* in war.",Sun Tzu,False,Prepare in silence. ⚔️\n\nFollow for warrior mindset 🔥
6,Discipline is the soul of an *army.*,George Washington,False,Stay organized. ⚔️\n\nFollow for daily focus 🔥
7,Out of suffering have emerged the *strongest* souls.,Khalil Gibran,False,Pain is a teacher. ⚔️\n\nFollow for resilience 🔥
8,Waste no more time arguing what a good man should be. *Be* one.,Marcus Aurelius,False,"Stop talking, start doing. ⚔️\n\nFollow for stoic wisdom 🔥"
9,"The world breaks everyone, and afterward, some are *strong* at the broken places.",Ernest Hemingway,False,Build back better. ⚔️\n\nFollow for warrior spirit 🔥
10,"If you are going through hell, *keep* going.",Winston Churchill,False,Never stop moving. ⚔️\n\nFollow for daily motivation 🔥
11,You have power over your mind—not outside events. *Realize* this.,Marcus Aurelius,False,Control the internal. ⚔️\n\nFollow for mindset growth 🔥
12,"Excellence is not an act, but a *habit.*",Aristotle,False,Consistency is king. ⚔️\n\nFollow for the grind 🔥
13,To be a warrior is to learn to be *unbreakable.*,Unknown,False,Forge your spirit. ⚔️\n\nFollow for daily discipline 🔥
14,He who has a why to live can bear almost any *how.*,Friedrich Nietzsche,False,Find your purpose. ⚔️\n\nFollow for stoic wisdom 🔥
15,What does not kill me makes me *stronger.*,Friedrich Nietzsche,False,Embrace the fire. ⚔️\n\nFollow for warrior mindset 🔥
16,"Discipline is doing what needs to be done, even if you don't *feel* like it.",Unknown,False,Feelings are temporary. ⚔️\n\nFollow for focus 🔥
17,"The successful warrior is the average man, with *laser-like* focus.",Bruce Lee,False,Sharpen your aim. ⚔️\n\nFollow for daily growth 🔥
18,Know yourself and you will win all *battles.*,Sun Tzu,False,Self-mastery first. ⚔️\n\nFollow for warrior code 🔥
19,Luck is what happens when preparation meets *opportunity.*,Seneca,False,Create your own luck. ⚔️\n\nFollow for stoic power 🔥
20,Hard times create *strong* men.,G. Michael Hopf,False,The cycle of growth. ⚔️\n\nFollow for the grind 🔥
21,It is a shame for a man to grow old without seeing the *beauty* of his body's strength.,Socrates,False,Build your temple. ⚔️\n\nFollow for physical discipline 🔥
22,Self-control is the chiefest *virtue.*,Ancient Proverb,False,Rule yourself first. ⚔️\n\nFollow for daily focus 🔥
23,"Do today what others won't, so tomorrow you can do what others *can't.*",Unknown,False,Pay the price now. ⚔️\n\nFollow for warrior mindset 🔥
24,The only easy day was *yesterday.*,Navy SEAL Motto,False,Keep pushing forward. ⚔️\n\nFollow for the grind 🔥
25,"Fall seven times, stand up *eight.*",Japanese Proverb,False,Persistence wins. ⚔️\n\nFollow for resilience 🔥
26,Man conquers the world by conquering *himself.*,Zeno,False,The ultimate victory. ⚔️\n\nFollow for stoic wisdom 🔥
27,"Great things are not done by impulse, but by a series of small things brought *together.*",Vincent van Gogh,False,Brick by brick. ⚔️\n\nFollow for daily habits 🔥
28,He who is not courageous enough to take risks will accomplish *nothing.*,Muhammad Ali,False,Face the fear. ⚔️\n\nFollow for warrior power 🔥
29,A person who never made a mistake never tried anything *new.*,Albert Einstein,False,Fail forward. ⚔️\n\nFollow for growth mindset 🔥
30,Be tolerant with others and *strict* with yourself.,Marcus Aurelius,False,High standards only. ⚔️\n\nFollow for stoic strength 🔥
