SN,Quote,Author,Posted,Caption
1,The obstacle in the path becomes the *path.*,Marcus Aurelius,True,Turn trials into triumphs. ⚔️ Follow for stoic strength 🔥
2,A warrior does not ask for permission to *excel.*,Unknown,True,Claim your greatness. ⚔️ Follow for the grind 🔥
3,Do not explain your philosophy. *Embody* it.,Epictetus,True,Action over words. ⚔️ Follow for daily discipline 🔥
4,Your mind is a weapon. Keep it *sharp.*,Unknown,True,Train the brain. ⚔️ Follow for mindset power 🔥
5,"The more you sweat in peace, the less you *bleed* in war.",Sun Tzu,True,Prepare in silence. ⚔️ Follow for warrior mindset 🔥
6,Discipline is the soul of an *army.*,George Washington,True,Stay organized. ⚔️ Follow for daily focus 🔥
7,Out of suffering have emerged the *strongest* souls.,Khalil Gibran,True,Pain is a teacher. ⚔️ Follow for resilience 🔥
8,Waste no more time arguing what a good man should be. *Be* one.,Marcus Aurelius,True,"Stop talking, start doing. ⚔️ Follow for stoic wisdom 🔥"
9,"The world breaks everyone, and afterward, some are *strong* at the broken places.",Ernest Hemingway,True,Build back better. ⚔️ Follow for warrior spirit 🔥
10,"If you are going through hell, *keep* going.",Winston Churchill,True,Never stop moving. ⚔️ Follow for daily motivation 🔥
11,You have power over your mind—not outside events. *Realize* this.,Marcus Aurelius,True,Control the internal. ⚔️ Follow for mindset growth 🔥
12,"Excellence is not an act, but a *habit.*",Aristotle,True,Consistency is king. ⚔️ Follow for the grind 🔥
13,To be a warrior is to learn to be *unbreakable.*,Unknown,True,Forge your spirit. ⚔️ Follow for daily discipline 🔥
14,He who has a why to live can bear almost any *how.*,Friedrich Nietzsche,True,Find your purpose. ⚔️Follow for stoic wisdom 🔥
15,What does not kill me makes me *stronger.*,Friedrich Nietzsche,False,Embrace the fire. ⚔️ Follow for warrior mindset 🔥
16,"Discipline is doing what needs to be done, even if you don't *feel* like it.",Unknown,False,Feelings are temporary. ⚔️ Follow for focus 🔥
17,"The successful warrior is the average man, with *laser-like* focus.",Bruce Lee,False,Sharpen your aim. ⚔️ Follow for daily growth 🔥
18,Know yourself and you will win all *battles.*,Sun Tzu,False,Self-mastery first. ⚔️ Follow for warrior code 🔥
19,Luck is what happens when preparation meets *opportunity.*,Seneca,False,Create your own luck. ⚔️ Follow for stoic power 🔥
20,Hard times create *strong* men.,G. Michael Hopf,False,The cycle of growth. ⚔️ Follow for the grind 🔥
21,It is a shame for a man to grow old without seeing the *beauty* of his body's strength.,Socrates,False,Build your temple. ⚔️ Follow for physical discipline 🔥
22,Self-control is the chiefest *virtue.*,Ancient Proverb,False,Rule yourself first. ⚔️ Follow for daily focus 🔥
23,"Do today what others won't, so tomorrow you can do what others *can't.*",Unknown,False,Pay the price now. ⚔️ Follow for warrior mindset 🔥
24,The only easy day was *yesterday.*,Navy SEAL Motto,False,Keep pushing forward. ⚔️ Follow for the grind 🔥
25,"Fall seven times, stand up *eight.*",Japanese Proverb,False,Persistence wins. ⚔️ Follow for resilience 🔥
26,Man conquers the world by conquering *himself.*,Zeno,False,The ultimate victory. ⚔️ Follow for stoic wisdom 🔥
27,"Great things are not done by impulse, but by a series of small things brought *together.*",Vincent van Gogh,False,Brick by brick. ⚔️ Follow for daily habits 🔥
28,He who is not courageous enough to take risks will accomplish *nothing.*,Muhammad Ali,False,Face the fear. ⚔️ Follow for warrior power 🔥
29,A person who never made a mistake never tried anything *new.*,Albert Einstein,False,Fail forward. ⚔️ Follow for growth mindset 🔥
30,Be tolerant with others and *strict* with yourself.,Marcus Aurelius,False,High standards only. ⚔️ Follow for stoic strength 🔥
